<?xml version="1.0" encoding="UTF-8"?>
<diagrama xmlns:xsi="http://www.w3.org/2001/XMLSchema-instance" xsi:noNamespaceSchemaLocation="composicion.xsd" nombre="Principal" estado="sin_validar"><entidad_nueva codigo="1" nombre="SeccionSala" tipo="cosa"><atributo codigo="2" nombre="nroSecc" tipo="Caracterizacion" cardinalidad_minima="1" cardinalidad_maxima="1"/><atributo codigo="4" nombre="nomSecc" tipo="Caracterizacion" cardinalidad_minima="1" cardinalidad_maxima="1"/><identificador><atributo>2</atributo></identificador><identificador><atributo>4</atributo></identificador></entidad_nueva><entidad_nueva codigo="6" nombre="Localidad" tipo="cosa"><atributo codigo="7" nombre="fila" tipo="Caracterizacion" cardinalidad_minima="1" cardinalidad_maxima="1"/><atributo codigo="9" nombre="nroButaca" tipo="Caracterizacion" cardinalidad_minima="1" cardinalidad_maxima="1"/><identificador><atributo>7</atributo><atributo>9</atributo></identificador><identificador><atributo>9</atributo><relacion>11</relacion></identificador></entidad_nueva><entidad_nueva codigo="14" nombre="Obra" tipo="cosa"><atributo codigo="15" nombre="idObra" tipo="Caracterizacion" cardinalidad_minima="1" cardinalidad_maxima="1"/><atributo codigo="17" nombre="titulo" tipo="Caracterizacion" cardinalidad_minima="1" cardinalidad_maxima="1"/><atributo codigo="19" nombre="autor" tipo="Caracterizacion" cardinalidad_minima="1" cardinalidad_maxima="n"/><atributo codigo="21" nombre="director" tipo="Caracterizacion" cardinalidad_minima="1" cardinalidad_maxima="n"/><atributo codigo="23" nombre="genero" tipo="Caracterizacion" cardinalidad_minima="1" cardinalidad_maxima="1"/><atributo codigo="25" nombre="Atributo" tipo="Caracterizacion" expresion="nroProxFuncion" cardinalidad_minima="1" cardinalidad_maxima="1"/><identificador><atributo>15</atributo></identificador><identificador><atributo>17</atributo></identificador></entidad_nueva><entidad_nueva codigo="27" nombre="Funcion" tipo="cosa"><atributo codigo="28" nombre="nroFunc" tipo="Caracterizacion" cardinalidad_minima="1" cardinalidad_maxima="1"/><atributo codigo="30" nombre="fecha" tipo="Caracterizacion" cardinalidad_minima="1" cardinalidad_maxima="1"/><atributo codigo="32" nombre="hora" tipo="Caracterizacion" cardinalidad_minima="1" cardinalidad_maxima="1"/><identificador><atributo>28</atributo><relacion>34</relacion></identificador><identificador><atributo>30</atributo><atributo>32</atributo><relacion>34</relacion></identificador></entidad_nueva><relacion codigo="11" nombre="SL" tipo="asociacion"><union_entidad_relacion  codigo="12" nombre="Union" entidad="1" cardinalidad_minima="1" cardinalidad_maxima="n"/><union_entidad_relacion  codigo="13" nombre="Union" entidad="6" cardinalidad_minima="1" cardinalidad_maxima=""/></relacion><relacion codigo="34" nombre="FO" tipo="asociacion"><union_entidad_relacion  codigo="35" nombre="Union" entidad="14" cardinalidad_minima="0" cardinalidad_maxima="n"/><union_entidad_relacion  codigo="36" nombre="Union" entidad="27" cardinalidad_minima="1" cardinalidad_maxima=""/></relacion><relacion codigo="37" nombre="VtaLoc" tipo="asociacion"><union_entidad_relacion  codigo="54" nombre="Union" entidad="6" cardinalidad_minima="" cardinalidad_maxima=""/><atributo codigo="38" nombre="tarj" tipo="Caracterizacion" cardinalidad_minima="0" cardinalidad_maxima="1"><atributo codigo="40" nombre="nomTarj" tipo="Caracterizacion" cardinalidad_minima="1" cardinalidad_maxima="1"/><atributo codigo="42" nombre="bco" tipo="Caracterizacion" cardinalidad_minima="1" cardinalidad_maxima="1"/><atributo codigo="44" nombre="nroTarj" tipo="Caracterizacion" cardinalidad_minima="1" cardinalidad_maxima="1"/><atributo codigo="46" nombre="nroAutoriz" tipo="Caracterizacion" cardinalidad_minima="1" cardinalidad_maxima="1"/><atributo codigo="48" nombre="cr" tipo="Caracterizacion" cardinalidad_minima="0" cardinalidad_maxima="1"><atributo codigo="50" nombre="cuotas" tipo="Caracterizacion" cardinalidad_minima="1" cardinalidad_maxima="1"/><atributo codigo="52" nombre="int" tipo="Caracterizacion" cardinalidad_minima="0" cardinalidad_maxima="1"/><atributo codigo="1" nombre="cuotas" tipo="Caracterizacion" cardinalidad_minima="0" cardinalidad_maxima="1"/><atributo codigo="3" nombre="int" tipo="Caracterizacion" cardinalidad_minima="0" cardinalidad_maxima="1"/></atributo></atributo></relacion></diagrama>
